{
  "schema_version": "1",
  "repo": "https://github.com/kafiirgie/bobthereviewer-demo-prs",
  "sha": "b99a40f0950b78255a8551e5fe04198f34762d25",
  "generated_at": "2026-09-27T13:07:30.977427Z",
  "modules": [
    {
      "path": "discount.py",
      "language": "python",
      "tier": "full",
      "last_commit": {
        "sha": "6546878",
        "date": "2026-09-27",
        "subject": "demo-base: sample pricing project",
        "pr": null
      }
    },
    {
      "path": "invoice.py",
      "language": "python",
      "tier": "full",
      "last_commit": {
        "sha": "6546878",
        "date": "2026-09-27",
        "subject": "demo-base: sample pricing project",
        "pr": null
      }
    },
    {
      "path": "pricing.py",
      "language": "python",
      "tier": "full",
      "last_commit": {
        "sha": "850a894",
        "date": "2026-09-27",
        "subject": "Raise the tax rate from 10% to 11%",
        "pr": null
      }
    },
    {
      "path": "tests/__init__.py",
      "language": "python",
      "tier": "full",
      "last_commit": {
        "sha": "6546878",
        "date": "2026-09-27",
        "subject": "demo-base: sample pricing project",
        "pr": null
      }
    },
    {
      "path": "tests/test_discount.py",
      "language": "python",
      "tier": "full",
      "last_commit": {
        "sha": "6546878",
        "date": "2026-09-27",
        "subject": "demo-base: sample pricing project",
        "pr": null
      }
    }
  ],
  "edges": [
    {
      "from": "invoice.py",
      "to": "discount.py",
      "kind": "import",
      "line": 3
    },
    {
      "from": "tests/test_discount.py",
      "to": "discount.py",
      "kind": "import",
      "line": 9
    },
    {
      "from": "tests/test_discount.py",
      "to": "invoice.py",
      "kind": "import",
      "line": 10
    }
  ],
  "unknowns": [],
  "limits": [
    "File-level imports only; which function calls which is in the per-PR evidence map.",
    "Imports of packages outside this repository are not drawn: they have no module here.",
    "Imports the analyser cannot resolve (dynamic, or escaping the repository root) are listed as unknowns, never dropped.",
    "Last commit per module is taken from git history at b99a40f."
  ]
}
